priority,area,recommendation,rationale,estimated_impact
High,ICU,Move 5 nurses from Maternity to ICU during evening and weekend peaks.,ICU average occupancy is 96% with 56.7 minute average waits.,Expected 10-18% wait-time reduction and improved throughput during surge windows.
High,ICU,Create a flexible surge pool of 8 beds for ICU and adjacent high-acuity pathways.,Sustained occupancy above 85% increases boarding risk and delays discharges.,Expected 6-12% improvement in bed availability and lower left-without-being-seen risk.
High,Emergency,Move 4 nurses from Maternity to Emergency during evening and weekend peaks.,Emergency average occupancy is 95% with 122.8 minute average waits.,Expected 10-18% wait-time reduction and improved throughput during surge windows.
High,Emergency,Create a flexible surge pool of 8 beds for Emergency and adjacent high-acuity pathways.,Sustained occupancy above 85% increases boarding risk and delays discharges.,Expected 6-12% improvement in bed availability and lower left-without-being-seen risk.
High,General Medicine,Move 4 nurses from Maternity to General Medicine during evening and weekend peaks.,General Medicine average occupancy is 86% with 96.7 minute average waits.,Expected 10-18% wait-time reduction and improved throughput during surge windows.
High,General Medicine,Create a flexible surge pool of 7 beds for General Medicine and adjacent high-acuity pathways.,Sustained occupancy above 85% increases boarding risk and delays discharges.,Expected 6-12% improvement in bed availability and lower left-without-being-seen risk.
Medium,Emergency,Add protected diagnostic blocks for Emergency and shift non-urgent MRI/CT to low-demand mornings.,"Equipment utilization averages 90.2%, indicating scheduling bottlenecks.",Expected 8-15% reduction in diagnostic turnaround time.
Medium,ICU,Add protected diagnostic blocks for ICU and shift non-urgent MRI/CT to low-demand mornings.,"Equipment utilization averages 90.5%, indicating scheduling bottlenecks.",Expected 8-15% reduction in diagnostic turnaround time.
